<?xml version="1.0" encoding="utf-8" ?>
<xs:schema xmlns:xs="http://www.w3.org/2001/XMLSchema">
  <xs:element name="users">
    <xs:complexType>
      <xs:sequence>
        <xs:element name="user" maxOccurs="unbounded">
          <xs:complexType>
            <xs:sequence>
              <xs:element name="userId">
                <xs:complexType>
                  <xs:simpleContent>
                    <xs:extension base="xs:positiveInteger">
                      <xs:attribute name="userType" type="xs:string" use="required" />
                    </xs:extension>
                  </xs:simpleContent>
                </xs:complexType>
              </xs:element>
              <xs:element name="password" type="xs:string" />
              <xs:element name="name">
                <xs:complexType>
                  <xs:sequence>
                    <xs:element name="first" type="xs:string" />
                    <xs:element name="middle" type="xs:string" minOccurs="0" />
                    <xs:element name="last" type="xs:string" />
                  </xs:sequence>
                </xs:complexType>
              </xs:element>
              <xs:element name="email" type="xs:string" />
              <xs:element name="phoneNumber" type="xs:positiveInteger" />
            </xs:sequence>
          </xs:complexType>
        </xs:element>
      </xs:sequence>
    </xs:complexType>
  </xs:element>
</xs:schema>